description,abbreviation,translation
Мыс на сев. оконечности о. Еглов.,о.,остров
"Мыс на р. Миге, на нем одноименное угодье д. Пяшница.",р.,река
"Мыс на р. Кемь, выше Северенского порога. Здесь были установлены заборы для вылова сига. Привязка к карте м.б. не является точной, ландшафт изменился из-за поднятия воды для ГЭС.",р.,река
"Мыс на р. Андога, угодье на нем.",р.,река
Мыс на р. Андога в окрестностях д. Олькино. На нем одноименный покос.,р.,река
Мыс на о. Корга.,о.,остров
Мыс на о. Канзанаволок.,о.,остров
Мыс на о. Бол. Жужмуй.,о.,остров
Мыс на о. Бол. Жужмуй,о.,остров
Мыс на о. Бол. Жужмуй,о.,остров
Мыс на крутом берегу р. Журавка или Ольховица (окрестности г. Пудож).,г.,город
Мыс на западном берегу озера Вашозера. К западу от о. Морозова.,о.,остров
"Мыс на зап. берегу Климецкого о-ва, к югу от деревни. Напротив о. Грыз.",о.,остров
"Мыс на вост. берегу о. Мягостров. Построена изба в конце 1990-х гг. Синицыным Александром Васильевичем, жителем с. Колежма. Личная тоня.",о.,остров
"Мыс за с. Сухое. Там стояли амбары, где разбирали рыбу.",с.,село
"Мыс в южной части о. Сало (оз. Ведлозеро). Здесь очень хороший пляж (песок). Раньше был очень густой лес, затем его вырубили.",о.,остров
"Мыс в сев. части оз. Ведлозеро (также к нему относятся 3 островка). В 1941 г. сюда привезли 10 тыс. кубометров дров - березу (чурки по 2 - 2,5 м). Началась война и дрова остались в воде. Во время войны финны распилили часть чурок на дрова, но большая часть осталась в озере. И до сих пор дрова крепкие, не сгнили.",г.,год
Мыс в Онежском озере у п. Онежский.,п.,посёлок
"Мыс в оз. Лижмозеро, находящийся на восточном берегу о. Большой.",о.,остров
Мыс в западной части о. Большой Леликовский на Онежском озере.,о.,остров
"Мыс в западной части о. Бол. Леликовский, на Онежском озере.",о.,остров
"Мыс в западной части о. Бол. Леликовский, на Онежском озере.",о.,остров
Мыс Белого моря. Напротив него о. Хедостров.,о.,остров
Мыс Белого моря в районе с. Нюхча,с.,село
Мыс Белого моря в районе г. Кемь,г.,город
"Мох в 10 км на запад от д.Юсова Гора. Пожни. Болото на запад от Кузарнды, в истоке р. Тамбицы, у хутора Бураки. Рядом покосы.",р.,река
Морской залив к северу от Колежмы. Старинная наважья тоня. С 1930 г. и по настоящее время (2021 г.) – один из основных промысловых участков колхоза «Заря Севера» и ИП с. Колежма,г.,год
"Место у Камня на о. Кижи, напротив магазина у д. Ямка.",о.,остров
Место на о. Фокенсуари в оз. Сямозеро,о.,остров
"Место за железной дорогой, у старого русла реки, в лес от канала 300 м. Там высокая скала, поля с глинистой землей. Когда-то камень взрывали. Сейчас дачи.",м.,метров
"Место в окрестностях д. Борково, туда за грибами ходили.",д.,деревня
Место в 100 м. от реки Шуи (левая сторона). В этом месте когда-то жило два монаха в келье. Рядом были кресты поставлены. Этих монахов убили. Привязка к карте м.б. не совсем точной.,м.,метров
Местность в 4 км от д. Колово в сторону г. Пудож. Раньше был кирпичный завод.,г.,город
Местечко между д. погост и д. Рубцова (Салмозеро).,д.,деревня
Мельница в д. Шелтозеро.,д.,деревня
Мель на р. Мига у д. Пяшница.,р.,река
"Мелкий и пересыхающий залив Белого моря, находящийся напротив о. Кабатов",о.,остров
Маяк на о. Тит-Луда. Перестал работать в конце 1990-х гг. Деревянная вышка маяка служила хорошим ориентиром мореплавателям до лета 2021 г. (разрушена штормом). Название Титлуда не использовалось местными жителями. На острове колония большого баклана.,г.,год
Маленький островок у южной оконечности о. Еглов.,о.,остров
"Маленький островок к вост. от о. Канзанаволок, между о. Канзанаволок и о. Марьестров.",о.,остров
"Маленький островок (как мякушка) на Онежском озере, за северной оконечностью полуострова Клим, рядом с о. Салоостров.",о.,остров
"Маленькие островки в Уницкой губе, между о. Пуростровом и о. Кокой.",о.,остров
Луды в Белом море в районе с. Поньгома,с.,село
"Луда, место рыбалки в Онежском озере у п. Онежский.",п.,посёлок
"Луда, место рыбалки в Онежском озере у п. Онежский.",п.,посёлок
"Луда у о. Сосновец, в 500 м. на с/в от деревни.",м.,метров
Луда на восток от о. Кижи.,о.,остров
"Луда в святухе, в 150 м. на ю/з от острова Острадний.",м.,метров
"Луда в Онежском озере у п-ова куднаволок, примерно в 200-300 м на с. - с.-в.",с.,село
Луда в оз. Карниж у д. Нюхово.,д.,деревня
"Луда в Кефтеньгубе, напротив д. Кефтеницы.",д.,деревня
"Луда в Белом море к северо-востоку от с. Нюхча. На ней стоял крест, который предупреждал об опасности, поскольку в большую воду её не видно и можно было попасть на скалу.",с.,село
"Луда в Белом море к северо-востоку от с. Нюхча. На ней стоял крест, который предупреждал об опасности, поскольку в большую воду её не видно и можно было попасть на скалу.",с.,село
"Луда в Белом море к северо-востоку от с. Нюхча. Луда поросла кустарником, который придает луде зеленый оттенок издали.",с.,село
Луда в Белом море к востоку от с. Колежма. Карт. о. Мал. Кузьмин,о.,остров
Луг/пожня д. Юргилицы.,д.,деревня
Лесоучасток в 7 км от п. Колово.,п.,посёлок
Лесные урочища в районе д. Новиково.,д.,деревня
"Лесное урочище по дороге из д. Водла в д. Падун, в районе горы Крутая бывш. нивы.",д.,деревня
"Лесное урочище по дороге из д. Водла в д. Падун, в районе горы Крутая бывш. нивы.",д.,деревня
"Лесное урочище по дороге в с. Кубово. Полянки к сев. от д. Сума. Пахотное угодье на лев. берегу р. Сума, по дороге в д. Кубово.",с.,село
"Лесное озеро на левом берегу р. Колоды, против устья р. Калма, соединяется с оз. Бол. Вирозеро ручьем Вироручей.",р.,река
"Лесное озеро на левом берегу р. Колоды, против устья р. Калма, соединяется с оз. Бол. Вирозеро ручьем Вироручей.",р.,река
Лесная ламбина возле г. Hietamäki.,г.,гора
"Лесистый и небольшой мыс, находится напротив Избяной луды, не доезжая до м. Гиблова со стороны деревни",м.,мыс
"Лес у с. Шелтозеро, тут пасли коров.",с.,село
Лес у п. Онежский.,п.,посёлок
Лес п. Онежский.,п.,посёлок
"Лес на западном берегу Доброй Губы,в 700 м. к ю/в от дер. Микково.",м.,метров
Лес д. Алексеево.,д.,деревня
левый приток р. Видлица,р.,река
левый приток р. Видлица,р.,река
Левый берег реки Нюхча в окрестностях с. Нюхча.,с.,село
"Ламба, находящаяся недалеко от с. Крошнозеро. Находится севернее оз. Кайдуярви.",с.,село
Ламба в районе д. Машозеро. Через него протекает р. Тунгуда. В оз. тянули невод в яме Alizentahkolamminhauda.,р.,река
Ламба в районе д. Кевятозеро.,д.,деревня
"Куст поселений на берегах одноименного озера, распол. в 22 км восточнее п. Кубово.",п.,посёлок
"Куст поселений (бывш. Нигижемская волость, с центром в д. Пречиста - Пречистинская церковь) в 4 км от Каршево: Погост, Подберезье, Алексеевская, Матвеевская, Гора Амозова, Гора Яковлева. Населенный пункт Каршевского с/совета, Пудожского района. -Дер. на рецы на Нежеме словет Ларивоновская -Дер. на Негижме -Дер. на Негижме на Урмо-озерки у часовни, а ныне в той деревне поставлена ново церковь Рожество пречистые -Дер. в Негижме же на Урмо-озере словет Олексеевская: Дорофейко Олексеев -Дер. на Негижме на Урмо-озерко Корчагинская [ПКОП 1563 г., с. 181]",г.,год
Крупный камень на побережье Белого моря в 3 верстах от дер. Колвица. Здесь была одноменная сельдяная тоня. В самом начале XX века эта территория входила в сферу хозяйственного использования жителей село Кандалакша. В 1900 г. колвичане получили от Кандалакши разрешение пользоваться р. Колвицей и сельдяными тонями до Синего камня (Никольский 1927: 155).,г.,год
"Крупные поля жителей с. Нюхча под г. Игнашиха. Низкое место, была проведена мелиорация, канавы прокопаны.",г.,гора
"Крупные поля жителей с. Нюхча под г. Игнашиха. Низкое место, была проведена мелиорация, канавы прокопаны.",г.,гора
Крупное озеро к востоку от д. Лапино (далеко).,д.,деревня
"Крест в 4 км от Толвуйского Погоста, на зимней дороге в Падмозеро. Построен в 1650 г. Строитель - некто Евдоким. Он укрывался в том месте под толстым деревом, избегая рекрутского набора. Он дал обет построить часовенку и крест в случае избавления от поимщиков, что и исполнил. Крест этот до настоящего времени называется Евдокимовым крестом. [Толвуйский приход // ОГВ, 1891, № 81].",г.,год
Корги в 200 м. от острова Пучеха. Затопляются водой.,м.,метров
Колхозная изба между м. Белужий и ур. Ленинградка на о. Мягостров.,м.,мыс
Колодец д. Сенькино.,д.,деревня
Колодец в д. Papimposad. (в составе с. Шолтозеро),с.,село
"Кладбище, находящееся на противоположном берегу озера Гомсельга от д. Гомсельга.",д.,деревня
"Кладбище жителей Кутка, под г. Малая Игнашиха. Привязка к карте не является точной.",г.,гора
"Кладбище в 2-3 км. от с. Нюхча за Виручьем. Здесь были похоронены люди, которые умерли от холеры в 1914 году.",с.,село
Канава от д. Пяшница к р. Миге.,р.,река
Камень в р. Нюхча ниже по течению от с. Нюхча. Здесь когда-то утонул мужчина.,р.,река
Камень в р. Нюхча в Нижней Моршихиной Лахте.,р.,река
Камень в 800 м к ю.-з. от д. Загорье.,д.,деревня
"Каменная гряда, обнажающаяся в отлив. Тянется от о. Карпушка к берегу.",о.,остров
Каменистый мыс напротив о. Максимиха,о.,остров
Каменистая отмель у о. Сеннуха.,о.,остров
Каменистая отмель на юге о. Мягостров.,о.,остров
Каменистая отмель на юге о. Мягостров.,о.,остров
Каменистая отмель (остров) от Слободы до Гайжево. Используется также как второе название Слободы (часть г. Кемь),г.,город
"Кайдуярви - озеро, находящееся недалеко от с. Крошнозеро, восточнее оз. Крошнозеро, севернее оз. Шогарви. Sinne suvaittih kävvä... perehen kel da sizäret.",с.,село
"к северу от г. Сортавалы, близ реки Каранкооя",г.,город
к северо-западу от г. Питкяранта,г.,город
к северо-западу от г. Питкяранта,г.,город
"Искусственно набранная коса из валунов, защищающая заводь (Озёрко) от волн с открытого моря в р-не ур. Ленинградка на о. Мягостров.",о.,остров
Индола у г. Ценжала (Ченжала).,г.,гора
Значительная губа Белого моря к северо-востоку от деревни Калгалакша со множеством островов и луд. Находится между материком и о. Оленим,о.,остров
"Зимняя дорога из Кеми в д. Летняя Река, от г. Горелиха на север.",г.,гора
Зимняя дорога в г. Кемь.,г.,город
Зимник на покосы к г. Рощелья.,г.,гора
"Земельное угодье бывшего Муромского монастыря. Пустошь, принадлежавшая Муромскому монастырю в 1582 г., выкашивали сена 20 копен.",г.,год
"Земельное угодье бывшего Муромского монастыря. Пустошь, принадлежавшая Муромскому монастырю в 1582 г., выкашивали сена 20 копен.",г.,год
Залив Hulkonlahti омывает с севера о. Тамханка и мыс Hulkonniemi. Граничит с прол. Келетинсалми.,о.,остров
"Залив Онежского озера в 8 км на с., с/з от д. Суйсарь.",с.,севере
Залив озера Кончезеро в районе д. Косалма.,д.,деревня
"Залив на р. Водла, вверх по реке от д. Водла.",р.,река
Залив на Онежском озере у п. Онежский.,п.,посёлок
Залив на оз. Водлозеро у д. Кевасалма.,д.,деревня
Залив на зап. берегу о. Колгостров.,о.,остров
"Залив Ладожского озера, через него мост, объединяющий разные районы г. Сортавала. Переходит на юге в залив Läppäjärvi. Короткой протокой Vakkosalmi соединяется с оз. Airanne.",г.,город
Залив в юго-вост. части о. Кижи (где ныне д. Сергеева). Воробьяне там всё приставали.,о.,остров
Залив в Уницкой губе у о. Куткостров.,о.,остров
Залив в оз. Лижмозеро к юго-востоку от о. Синягостров.,о.,остров
"Залив в вост. части о. Сало (оз. Ведлозеро). Это место имеет открытое пространство, отсюда и название.",о.,остров
"Залив Белого моря к западу от г. Кандалакша, в которую впадает река Кандарека.",г.,город
"Залив Белого моря в районе с. Нюхча. Это западная часть Саруцкой губы, от мыса Кустов наволок до Варничного наволока.",с.,село
зал. Перттилахти расположен восточнее г. Мустамяки (высота 61.2),г.,гора
Закол на р. Кемь из-под Заборного порога. Ставится заводь к Тюрюкаллиеву. Привязка к карте не является точной.,р.,река
"Загубина расположена на западном берегу Матгубы, напротив г. Кондопога.",г.,город
Загубина р. Шуя. Привязка к карте м.б. не совсем точной.,р.,река
Загубина на р. Сумарека.,р.,река
загубина (песчаный берег) оз. сумзера на о. Сумостров. Раньше здесь купались только женщины. Здесь купаются жители деревни.,о.,остров
"Заводь в оз. Ухтомьярское, рядом с о. Шубач, Катька утонула.",о.,остров
"Забор для ловли мелкой рыбы, над Боярской губой с островками у о. Пухкила (Пуккила). Привязка к карте м.б. не совсем точной.",о.,остров
"Забор для ловли мелкой рыбы у о. Гусинец, с летней стороны, ниже и ближе к нему. Привязка к карте м.б. не совсем точной.",о.,остров
"Дорога, ведущая от г. Пудож до п. Кодачи.",п.,посёлок
"Дорога, ведущая на пристань к Онежскому озеру у с. Шелтозера.",с.,село
Дорога на р. Шолу и далее в дер. Мартыновское (Лошны).,р.,река
Дорога в г. Пудож.,г.,город
Дом в д. Сеерный Конец.,д.,деревня
Дом в д. Пряккиля. Старый дом 1927 г.,г.,год
Дом в д. Гижино.,д.,деревня
"Длинные, далеко вдающиеся в море низменные полуострова в сев.-зап. части о. Мягостров. Солончаковые луга. Высокие приливы и ветровые нагоны могут их затапливать.",о.,остров
"Деревня. библиотека, Vas'ke - Sen'kalankodi (Абрамов), Makarie (Trubetskoi), Makarie (Антипин), sluuži Kemissä, Iivana (Trubetskoi), Vas'ke (Antipinantalo), богатый, 2 этажа, хозяин арестован. Seppä-Iivana (Абрамов), Prokon (Антипин), Hodora-emändä (Антипин), rikkaudu talo oli. Papinkodi Saša (Rinsin) Александр Рынцын, председатель, Miihkali (Полиектов Михаил Андреевич), Hočolankodi (Филиппов), Miču (Дмитрий), Luškovantalo (Лужков) - venäläini, Vas'ke - velli (karjalaini), Fed'an Ulli (Полиектова), Hodorankodi (Ананьин), Saška (Александр) (Ананьин), Marfa (Ананьин), Dyrgi, Levonkodi (Яковлев). Kolmičči palo kylä, jäi vai kirikkö da popovskoi škola. Venehet niis palettih. Nittoh pienie kodiloi stroittih. Pappi vuidi ymbäri pyörähti rissin kera. Hyö sohraniuvuttih. Второй ряд домов: Juakko (Кондратьев), lapset: Načči, Ol'oksei (Полиектов) - Алексей Федорович (моряком был, в Норвегию ходил. За одно лето зарабатывали на корову, лошадь и дом могли построить), lapset: Mika, Iibu (1 kuoli), Fedka (1 kuoli), Anni, Antista(Анфиса), Liiska Fed'a (Гаврилов), pojat: Fedän Ser'o, Ol'oksei (арестован), Muarie (Нечаева) D'yrgi (Егор) погиб на войне (Кондратьев), Kirilä (Пабуев), pojat: Mika da Lari - погиб на войне. Petra (Петр) (Савин), Saša (Александр) (Амосов), Iinakonkodi - Arka (Аркадий) (Пабуев), Griiša (Артемьев), Odr'ouna, Mikkula (Полиектов) арестован был судьей в Кеми 37 г., Iivana (Иван Кузьмич) (Полиектов), Paško da Miikula (арестован) - братья (Абрамов), Laukka, Mokki-tuatto, Simana-poiga (Антипин), papinškola kirikkö, pantih petazet (первые жители ловили птицу), kirikkö oli toizessa pakassa ... (?), tuldih švedat, poltettih da upotettih kellot. Ojan rannalla oli kirikkö. Melliččy - Haugipohjanoja.",г.,год
"Деревня, расположенная у юго-восточного края о. Карасозеро.",о.,озеро
"Деревня, расположенная к ю.-з. от с. Шуньга, за озером Валгомозеро.",с.,село
"Деревня, расположенная к с.-з. от с. Шуньга.",с.,село
Деревня севернее с. Ведлозеро,с.,село
Деревня при впадении р. Колода в р. Водла.,р.,река
"Деревня недалеко от г. Пудож, рядом с д. Левино.",г.,деревня
Деревня находится в 12 км к северо-западу от г. Питкяранта,г.,город
Деревня находится в 12 км к северо-западу от г. Питкяранта,г.,город
Деревня на ю/з от с. Ивановское.,с.,село
Деревня на сев. от с. Георгиевское.,с.,село
"Деревня на р. Рагнукса, в 33 км от г. Пудож, 592 жителя, входила в Авдеевский сельсовет.",р.,река
Деревня на р. Водла в 24 км от г. Пудож.,г.,город
